<?xml version="1.0" encoding="UTF-8"?>
<biblioteca xmlns:xsi="http://www.w3.org/2001/XMLSchema-instance" xsi:noNamespaceSchemaLocation="Enunciado2XSD.xsd">

  <libro codigo="A12" titulo="Harry Potter" fecha_publicacion="1997-06-30">
    <autor>J.K. Rowling</autor>
    <editorial>Bloomsbury Publishing</editorial>
    <edicion>3</edicion>
    <isbn>12-34-5678</isbn>
    <donacion/>
    <ubicacion sede="norte"/>
    <caracteristicas>
      <Numero_Paginas>240</Numero_Paginas>
      <encuadernación>Bolsillo</encuadernación>
    </caracteristicas>
  </libro>
  
  <libro codigo="B34" titulo="El laberinto del mal(Star Wars)" fecha_publicacion="1977-08-27">
    <autor>James Luceno</autor>
    <editorial>Del Rey Books</editorial>
    <isbn>12-11-2222</isbn>
    <ubicacion sede="sur"/>
    <caracteristicas>
      <Numero_Paginas>180</Numero_Paginas>
      <encuadernación>Rústica</encuadernación>
    </caracteristicas>
  </libro>
  
</biblioteca>